Topic/Theme,Key Points,Supporting Evidence,Entities,Timeline/Context,Impact/Reasoning
"Economic Reform (Operation Vulindlela)","Accelerating economic reform, opening investment and competition.","Through Operation Vulindlela, we have made significant progress in accelerating economic reform and opening the way for investment and competition.","Operation Vulindlela","Ongoing","Foster economic growth and recovery."
"Infrastructure Investment","Investing in roads, bridges, rail lines, ports, dams, wind/solar farms.","We are investing across our country in roads, bridges, rail lines, ports, dams, wind and solar farms.","Government of South Africa","Ongoing","Strengthen national infrastructure."
"Job Creation (Employment Stimulus)","Created over 2.5 million opportunities, mainly for youth and women.","We have created over 2.5 million opportunities through the Presidential Employment Stimulus, mainly for young people and women.","Presidential Employment Stimulus, EPWP, CWP","Past/Ongoing","Reducing unemployment and poverty."
"Social Protection (SRD Grant)","Expanded social protection to reduce food poverty.","By expanding our social protection system through the Social Relief of Distress (SRD) Grant, we have reduced the number of people living in food poverty.","SRD Grant","Ongoing","Mitigate hunger and poverty."
"Anti-Corruption & Institutional Rebuilding","Strengthening anti-corruption laws, rebuilding SARS and Investigating Directorate.","We are strengthening our anti-corruption laws., The work we have done to rebuild key institutions from state capture is showing results.","SARS, Investigating Directorate Against Corruption, FATF","Ongoing","Ensuring ethical governance and rule of law."
"Organised Crime (General Focus)","Stepping up the fight using technology, intelligence, and integrated law enforcement.","Our primary focus this year is stepping up the fight against organised crime and criminal syndicates using technology, intelligence and integrated law enforcement.","Government of National Unity","This year","Addressing the immediate threat to democracy and economy."
"Organised Crime (Gang Violence & Illegal Mining)","Deploying SANDF to support police in Western Cape and Gauteng; tactical plan within days.","I am deploying the South African National Defence Force (SANDF) to support the police..., I have directed the Minister of Police and the SANDF to develop a tactical plan where our security forces should be deployed within the next few days in the Western Cape and Gauteng...","SANDF, Minister of Police, SAPS, Western Cape, Gauteng","Next few days","Dismantle criminal networks and stop gang violence."
"Gun Crime Control","Streamlining firearm legislation and increasing enforcement of gun laws.","We are going to tackle gun crime by streamlining legislation and regulations on licencing, possessing and trading in firearms and ammunition.","Government of South Africa","This year","Reduce violent crime and illegal firearm use."
"Police Capacity Building","Recruitment of 5,500 additional police officers this year.","We are putting more boots on the ground through the recruitment this year of 5 500 additional police officers...","SAPS","This year","Strengthening law enforcement visibility and response."
